event,event_key
تأسیس پلیس صلح بین‌ الملل,تأسیس پلیس صلح بین‌ الملل
زادروز فریدریش شیلر  نمایش‌نامه‌نویس و شاعر آلمانی,زادروز فریدریش شیلر  نمایش‌نامه‌نویس و شاعر آلمانی
زادروز فیودور میخاییلوویچ داستایوسکی نویسندهٔ سرشناس و تأثیرگذار روس، خالق رمان جنایت و مکافات و برادران کارامازوف,زادروز فیودور میخاییلوویچ داستایوسکی نویسندهٔ سرشناس و تأثیرگذار روس، خالق رمان جنایت و مکافات و برادران کارامازوف
درگذشت آرتوری ایلماری ویرتانن شیمیدان فنلاندی، برندهٔ جایزه نوبل شیمی سال ۱۹۴۵,درگذشت آرتوری ایلماری ویرتانن شیمیدان فنلاندی، برندهٔ جایزه نوبل شیمی سال ۱۹۴۵
زادروز نیما یوشیج پدر شعر نو پارسی,زادروز نیما یوشیج پدر شعر نو پارسی
زادروز جان استرات ، فیزیکدان انگلیسی، برندهٔ جایزه نوبل فیزیک سال ۱۹۰۴,زادروز جان استرات ، فیزیکدان انگلیسی، برندهٔ جایزه نوبل فیزیک سال ۱۹۰۴
درگذشت هاراطون داویدیان بنیانگذار روانپزشکی درایران,درگذشت هاراطون داویدیان بنیانگذار روانپزشکی درایران
زادروز ادوارد دویسی زیست‌شیمیدان آمریکایی، برندهٔ جایزه نوبل فیزیولوژی و پزشکی سال ۱۹۴۳,زادروز ادوارد دویسی زیست‌شیمیدان آمریکایی، برندهٔ جایزه نوبل فیزیولوژی و پزشکی سال ۱۹۴۳
زادروز رابرت لویی استیونسن نویسندهٔ اسکاتلندی، خالق جزیره گنج و دکتر جکیل و آقای هاید,زادروز رابرت لویی استیونسن نویسندهٔ اسکاتلندی، خالق جزیره گنج و دکتر جکیل و آقای هاید
روز جهانی دیابت,روز جهانی دیابت
درگذشت سعید نفیسی، نویسنده، ادیب، تاریخ‌نگار، مترجم و شاعر ایرانی,درگذشت سعید نفیسی، نویسنده، ادیب، تاریخ‌نگار، مترجم و شاعر ایرانی
روز کتاب و کتابخوانی,روز کتاب و کتابخوانی
درگذشت هنری تاب شیمیدان آمریکایی کانادایی، برندهٔ جایزه نوبل شیمی سال ۱۹۸۳,درگذشت هنری تاب شیمیدان آمریکایی کانادایی، برندهٔ جایزه نوبل شیمی سال ۱۹۸۳
درگذشت میلتون فریدمن اقتصاددان آمریکایی، برنده جایزه نوبل اقتصاد سال ۱۹۷۶,درگذشت میلتون فریدمن اقتصاددان آمریکایی، برنده جایزه نوبل اقتصاد سال ۱۹۷۶
اختراع «موشواره» برای رایانه توسط دکتر داگلاس انگلبارت.,اختراع «موشواره» برای رایانه توسط دکتر داگلاس انگلبارت.
زادروز مارتین اسکورسیزی ، کارگردان، فیلمنامه‌نویس، تهیه کننده، بازیگر و تاریخدان ایتالیایی-آمریکایی فیلم و سینما، برندهٔ جایزه اسکار,زادروز مارتین اسکورسیزی ، کارگردان، فیلمنامه‌نویس، تهیه کننده، بازیگر و تاریخدان ایتالیایی-آمریکایی فیلم و سینما، برندهٔ جایزه اسکار
روز جهانی فلسفه,روز جهانی فلسفه
درگذشت والتر نرنست شیمیدان آلمانی، برندهٔ جایزه نوبل شیمی سال ۱۹۲۰,درگذشت والتر نرنست شیمیدان آلمانی، برندهٔ جایزه نوبل شیمی سال ۱۹۲۰
زادروز لوئی داگر نقاش، مخترع و فیزیکدان بزرگ فرانسوی,زادروز لوئی داگر نقاش، مخترع و فیزیکدان بزرگ فرانسوی
درگذشت ستارخان ملقب به سردار ملی از سرداران جنبش مشروطه ایران,درگذشت ستارخان ملقب به سردار ملی از سرداران جنبش مشروطه ایران
درگذشت فرانتس شوبرت موسیقیدان اتریشی,درگذشت فرانتس شوبرت موسیقیدان اتریشی
زادروز ایندیرا گاندی ،سیاستمدار هندی,زادروز ایندیرا گاندی ،سیاستمدار هندی
روز جهانی آقایان,روز جهانی آقایان
روز جهانی کودک,روز جهانی کودک
درگذشت لئو تولستوی نویسنده و فعال سیاسی و اجتماعی روس,درگذشت لئو تولستوی نویسنده و فعال سیاسی و اجتماعی روس
زادروز نادین گوردیمر نویسنده و فعال سیاسی اهل آفریقای جنوبی، برندهٔ جایزه نوبل ادبیات سال ۱۹۹۱,زادروز نادین گوردیمر نویسنده و فعال سیاسی اهل آفریقای جنوبی، برندهٔ جایزه نوبل ادبیات سال ۱۹۹۱
نخستین پرواز ثبت‌شده انسان با بالون توسط برادران مون‌گلفیه در پاریس,نخستین پرواز ثبت‌شده انسان با بالون توسط برادران مون‌گلفیه در پاریس
زادروز ولتر، فیلسوف و نویسندهٔ فرانسوی عصر روشنگر,زادروز ولتر، فیلسوف و نویسندهٔ فرانسوی عصر روشنگر
آذر جشن,آذر جشن
درگذشت هانس آدولف کربس پزشک و زیست‌شیمیدان بریتانیایی-آلمانی، برندهٔ جایزه نوبل فیزیولوژی و پزشکی سال ۱۹۵۳,درگذشت هانس آدولف کربس پزشک و زیست‌شیمیدان بریتانیایی-آلمانی، برندهٔ جایزه نوبل فیزیولوژی و پزشکی سال ۱۹۵۳
درگذشت غلامحسین درویش معروف به «درویش‌خان»، هنرمند نامی و استاد موسیقی ایرانی اواخر دورهٔ قاجاریه,درگذشت غلامحسین درویش معروف به «درویش‌خان»، هنرمند نامی و استاد موسیقی ایرانی اواخر دورهٔ قاجاریه
زادروز یوهان دیدریک وان در والس دانشمند و ترمودینامیک‌دان هلندی، برندهٔ جایزهٔ فیزیک نوبل سال ۱۹۱۰,زادروز یوهان دیدریک وان در والس دانشمند و ترمودینامیک‌دان هلندی، برندهٔ جایزهٔ فیزیک نوبل سال ۱۹۱۰
شهادت حضرت فاطمه زهرا سلام الله علیها,شهادت حضرت فاطمه زهرا سلام الله علیها
زادروز کیهان کلهر آهنگساز و نوازندهٔ برجسته ایرانی,زادروز کیهان کلهر آهنگساز و نوازندهٔ برجسته ایرانی
زادروز باروخ اسپینوزا ، فیلسوف مشهور هلندی,زادروز باروخ اسپینوزا ، فیلسوف مشهور هلندی
ارائه نظریه نسبیت عام توسط آلبرت انیشتین,ارائه نظریه نسبیت عام توسط آلبرت انیشتین
روز جهانی مبارزه با خشونت علیه زنان,روز جهانی مبارزه با خشونت علیه زنان
زادروز کارل بنز مهندس آلمانی ،طراح موتور ماشین، اتومبیل بنزین سوز و بنیانگذار مرسدس بنز,زادروز کارل بنز مهندس آلمانی ،طراح موتور ماشین، اتومبیل بنزین سوز و بنیانگذار مرسدس بنز
درگذشت جبار باغچه‌بان بنیان‌گذار نخستین کودکستان و نخستین مدرسه ناشنوایان ایران، اولین مؤلف و ناشر کتاب کودک در ایران,درگذشت جبار باغچه‌بان بنیان‌گذار نخستین کودکستان و نخستین مدرسه ناشنوایان ایران، اولین مؤلف و ناشر کتاب کودک در ایران
روز بسیج مستضعفان,روز بسیج مستضعفان
درگذشت هاینریش هرتز، ریاضیدان و فیزیک‌دان برجستهٔ آلمانی,درگذشت هاینریش هرتز، ریاضیدان و فیزیک‌دان برجستهٔ آلمانی
درگذشت یوجین اونیل نمایشنامه‌نویس آمریکایی، برندهٔ جایزه ادبیات نوبل سال ۱۹۳۶,درگذشت یوجین اونیل نمایشنامه‌نویس آمریکایی، برندهٔ جایزه ادبیات نوبل سال ۱۹۳۶
درگذشت ایدا لاولیس ریاضیدان انگلیسی، نخستین برنامه‌ساز رایانه,درگذشت ایدا لاولیس ریاضیدان انگلیسی، نخستین برنامه‌ساز رایانه
روز نیروی دریایی,روز نیروی دریایی
زادروز ویلیام بلیک شاعر و نقاش بریتانیایی,زادروز ویلیام بلیک شاعر و نقاش بریتانیایی
زادروز کلود لوی-استروس قوم‌شناس و انسان‌شناس فرانسوی، از نظریه‌پردازان انسان‌شناسی مدرن,زادروز کلود لوی-استروس قوم‌شناس و انسان‌شناس فرانسوی، از نظریه‌پردازان انسان‌شناسی مدرن
درگذشت یقیشه چارنتس شاعر، فعال مدنی ارمنستانی,درگذشت یقیشه چارنتس شاعر، فعال مدنی ارمنستانی
زادروز گائتانو دونیزتی آهنگساز ایتالیایی,زادروز گائتانو دونیزتی آهنگساز ایتالیایی
جشن آذرگان ،آذر روز,جشن آذرگان ،آذر روز
زادروز تئودور مومسن تاریخدان، حقوقدان، روزنامه‌نگار، سیاستمدار و باستان‌شناس آلمانی، برندهٔ جایزه نوبل ادبیات سال ۱۹۰۲,زادروز تئودور مومسن تاریخدان، حقوقدان، روزنامه‌نگار، سیاستمدار و باستان‌شناس آلمانی، برندهٔ جایزه نوبل ادبیات سال ۱۹۰۲
زادروز مارک توین نویسندهٔ آمریکایی، خالق ماجراهای هاکلبری فین و ماجراهای تام سایر,زادروز مارک توین نویسندهٔ آمریکایی، خالق ماجراهای هاکلبری فین و ماجراهای تام سایر
روز مجلس,روز مجلس
روز جهانی ایدز,روز جهانی ایدز
مراسم تاج‌گذاری ناپلئون بُناپارت به عنوان امپراتور فرانسه در کلیسای نوتردام پاریس برگزار شد.,مراسم تاج‌گذاری ناپلئون بُناپارت به عنوان امپراتور فرانسه در کلیسای نوتردام پاریس برگزار شد.
کشته شدن میرزا کوچک خان جنگلی مبارز و رهبر جنبش ملی جنگل,کشته شدن میرزا کوچک خان جنگلی مبارز و رهبر جنبش ملی جنگل
درگذشت لوییز اف لیلویر بیوشیمیست آرژانتینی، برندهٔ جایزه نوبل فیزیولوژی و پزشکی سال ۱۹۷۰,درگذشت لوییز اف لیلویر بیوشیمیست آرژانتینی، برندهٔ جایزه نوبل فیزیولوژی و پزشکی سال ۱۹۷۰
روز جهانی معلولان,روز جهانی معلولان
درگذشت کلود شابرول کارگردان فرانسوی، از بنیان‌گذاران موج نوی فرانسه,درگذشت کلود شابرول کارگردان فرانسوی، از بنیان‌گذاران موج نوی فرانسه
زادروز کیم دای جونگ رئیس‌جمهور کره جنوبی از سال ۱۹۹۸ تا ۲۰۰۳، برندهٔ جایزه صلح نوبل سال ۲۰۰۰,زادروز کیم دای جونگ رئیس‌جمهور کره جنوبی از سال ۱۹۹۸ تا ۲۰۰۳، برندهٔ جایزه صلح نوبل سال ۲۰۰۰
رسمی شدن قانون اساسی جمهوری اسلامی ایران,رسمی شدن قانون اساسی جمهوری اسلامی ایران
روز بیمه,روز بیمه
زادروز توماس کارلایل ، متفکر و تاریخدان اسکاتلندی,زادروز توماس کارلایل ، متفکر و تاریخدان اسکاتلندی
درگذشت توماس هانت مورگان زیست‌شناس آمریکایی، برندهٔ جایزه نوبل فیزیولوژی و پزشکی سال ۱۳۱۲,درگذشت توماس هانت مورگان زیست‌شناس آمریکایی، برندهٔ جایزه نوبل فیزیولوژی و پزشکی سال ۱۳۱۲
درگذشت نلسون ماندلا نخستین رئیس جمهور آفریقای جنوبی، برندهٔ جایزه صلح نوبل سال ۱۹۹۳,درگذشت نلسون ماندلا نخستین رئیس جمهور آفریقای جنوبی، برندهٔ جایزه صلح نوبل سال ۱۹۹۳
روز حسابدار,روز حسابدار
زادروز جرج پرتر شیمیدان انگلیسی، برندهٔ جایزه نوبل شیمی سال ۱۹۶۷,زادروز جرج پرتر شیمیدان انگلیسی، برندهٔ جایزه نوبل شیمی سال ۱۹۶۷
روز دانشجو,روز دانشجو
کناره گیری رضا شاه از سلطنت به نفع پسرش محمدرضا پهلوی در پی اشغال ایران در جنگ جهانی دوم توسط نیروهای متفقین,کناره گیری رضا شاه از سلطنت به نفع پسرش محمدرضا پهلوی در پی اشغال ایران در جنگ جهانی دوم توسط نیروهای متفقین
درگذشت الی دوکامن، فعال صلح، برندهٔ جایزه صلح نوبل سال ۱۹۰۲ به‌همراه چارلز آلبرت گوبات,درگذشت الی دوکامن، فعال صلح، برندهٔ جایزه صلح نوبل سال ۱۹۰۲ به‌همراه چارلز آلبرت گوبات
زادروز داریوش مهرجویی کارگردان، نویسنده و مترجم ایرانی.,زادروز داریوش مهرجویی کارگردان، نویسنده و مترجم ایرانی.
زادروز ژان سیبلیوس، آهنگساز فنلاندی و از محبوب‌ترین چهره‌های موسیقی کلاسیک در قرن ۱۹ و اوایل قرن بیستم,زادروز ژان سیبلیوس، آهنگساز فنلاندی و از محبوب‌ترین چهره‌های موسیقی کلاسیک در قرن ۱۹ و اوایل قرن بیستم
درگذشت جرج بول ریاضیدان و فیلسوف انگلیسی، از بنیان‌گذاران علم کامپیوتر,درگذشت جرج بول ریاضیدان و فیلسوف انگلیسی، از بنیان‌گذاران علم کامپیوتر
زادروز فریتس هابر شیمیدان آلمانی، برندهٔ جایزه نوبل شیمی سال ۱۹۱۸,زادروز فریتس هابر شیمیدان آلمانی، برندهٔ جایزه نوبل شیمی سال ۱۹۱۸
درگذشت گوستاف دالن کارخانه‌دار سوئدی، مخترع شیرهای خودکار، برندهٔ جایزه نوبل فیزیک سال ۱۹۱۲,درگذشت گوستاف دالن کارخانه‌دار سوئدی، مخترع شیرهای خودکار، برندهٔ جایزه نوبل فیزیک سال ۱۹۱۲
زادروز حیدر رقابی متخلص به هاله از شاعران معاصر اهل ایران,زادروز حیدر رقابی متخلص به هاله از شاعران معاصر اهل ایران
زادروز ایدا لاولیس ، ریاضیدان و نخستین برنامه‌ساز رایانه,زادروز ایدا لاولیس ، ریاضیدان و نخستین برنامه‌ساز رایانه
درگذشت آلفرد نوبل شیمیدان، مهندس، مبتکر و اسلحه‌ساز سوئدی، بنیانگذار جایزه نوبل,درگذشت آلفرد نوبل شیمیدان، مهندس، مبتکر و اسلحه‌ساز سوئدی، بنیانگذار جایزه نوبل
ولادت حضرت فاطمه زهرا سلام الله علیها و روز مادر,ولادت حضرت فاطمه زهرا سلام الله علیها و روز مادر
زادروز نجیب محفوظ نویسنده و نمایشنامه‌نویس مصری، برندهٔ جایزه نوبل ادبیات,زادروز نجیب محفوظ نویسنده و نمایشنامه‌نویس مصری، برندهٔ جایزه نوبل ادبیات
درگذشت ونسانت دو وینیو بیوشیمیدان آمریکایی، برندهٔ جایزه نوبل شیمی سال ۱۹۵۵,درگذشت ونسانت دو وینیو بیوشیمیدان آمریکایی، برندهٔ جایزه نوبل شیمی سال ۱۹۵۵
درگذشت ابوالحسن صدیقی نقاش و مجسمه‌ساز برجستهٔ ایرانی,درگذشت ابوالحسن صدیقی نقاش و مجسمه‌ساز برجستهٔ ایرانی
روز جهانی کوه نوردی,روز جهانی کوه نوردی
زادروز احمد شاملو شاعر و نویسنده و مترجم ایرانی,زادروز احمد شاملو شاعر و نویسنده و مترجم ایرانی
زادروز آلفرد ورنر شیمیدان سوئیسی، برندهٔ جایزه نوبل شیمی سال ۱۹۱۳,زادروز آلفرد ورنر شیمیدان سوئیسی، برندهٔ جایزه نوبل شیمی سال ۱۹۱۳
درگذشت ویکتور گرینیارد شیمیدان فرانسوی، برندهٔ جایزه نوبل شیمی سال ۱۹۱۲,درگذشت ویکتور گرینیارد شیمیدان فرانسوی، برندهٔ جایزه نوبل شیمی سال ۱۹۱۲
درگذشت پل ساموئلسون اقتصاددان اهل ایالات متحده آمریکا، برندهٔ جایزه نوبل اقتصاد سال۱۹۷۰,درگذشت پل ساموئلسون اقتصاددان اهل ایالات متحده آمریکا، برندهٔ جایزه نوبل اقتصاد سال۱۹۷۰
درگذشت ویسنته آله‌ایخاندره شاعر برجستهٔ متولد کشور اسپانیا، برندهٔ جایزه نوبل ادبیات سال ۱۹۷۷,درگذشت ویسنته آله‌ایخاندره شاعر برجستهٔ متولد کشور اسپانیا، برندهٔ جایزه نوبل ادبیات سال ۱۹۷۷
زادروز تیکو براهه، منجم دانمارکی,زادروز تیکو براهه، منجم دانمارکی
زادروز آنری بکرل فیزیکدان فرانسوی، برندهٔ جایزه نوبل فیزیک سال ۱۹۰۳,زادروز آنری بکرل فیزیکدان فرانسوی، برندهٔ جایزه نوبل فیزیک سال ۱۹۰۳
درگذشت ولفگانگ پائولی فیزیکدان بلندپایه اتریشی,درگذشت ولفگانگ پائولی فیزیکدان بلندپایه اتریشی
روز پژوهش,روز پژوهش
درگذشت ویلیام سامرست موآم، داستان‌نویس و نمایشنامه‌نویس انگلیسی,درگذشت ویلیام سامرست موآم، داستان‌نویس و نمایشنامه‌نویس انگلیسی
روز حمل و نقل,روز حمل و نقل
زادروز لودویگ فان بتهوون، موسیقیدان برجستهٔ آلمانی,زادروز لودویگ فان بتهوون، موسیقیدان برجستهٔ آلمانی
زادروز ویلی برانت سیاستمدار آلمانی، صدر اعظم آلمان غربی از ۱۹۶۹ تا ۱۹۷۴، برندهٔ جایزه صلح نوبل ۱۹۷۱,زادروز ویلی برانت سیاستمدار آلمانی، صدر اعظم آلمان غربی از ۱۹۶۹ تا ۱۹۷۴، برندهٔ جایزه صلح نوبل ۱۹۷۱
زادروز استیون اسپیلبرگ کارگردان، تهیه‌کننده و فیلم‌نامه‌نویس آمریکایی، برندهٔ ۳ جایزه اسکار و یکی از موفقترین کارگردانان تاریخ سینما,زادروز استیون اسپیلبرگ کارگردان، تهیه‌کننده و فیلم‌نامه‌نویس آمریکایی، برندهٔ ۳ جایزه اسکار و یکی از موفقترین کارگردانان تاریخ سینما
زادروز آلبرت آبراهام مایکلسون فیزیکدان آمریکایی روس‌تبار، برندهٔ جایزه فیزیک نوبل سال ۱۹۰۷,زادروز آلبرت آبراهام مایکلسون فیزیکدان آمریکایی روس‌تبار، برندهٔ جایزه فیزیک نوبل سال ۱۹۰۷
درگذشت رابرت میلیکان فیزیکدان برجستهٔ آمریکایی، برندهٔ جایزه نوبل فیزیک سال ۱۹۲۳,درگذشت رابرت میلیکان فیزیکدان برجستهٔ آمریکایی، برندهٔ جایزه نوبل فیزیک سال ۱۹۲۳
زادروز دیوید بوهم فیزیک دان مشهور آمریکایی,زادروز دیوید بوهم فیزیک دان مشهور آمریکایی
زادروز یاروسلاو هیروفسکی شیمیدان و مخترع اهل جمهوری چک، برنده جایزه نوبل شیمی سال ۱۹۵۹,زادروز یاروسلاو هیروفسکی شیمیدان و مخترع اهل جمهوری چک، برنده جایزه نوبل شیمی سال ۱۹۵۹
درگذشت جان استاینبک نویسندهٔ آمریکایی، خالق خوشه‌های خشم، برندهٔ جایزه نوبل ادبیات سال ۱۹۶۲,درگذشت جان استاینبک نویسندهٔ آمریکایی، خالق خوشه‌های خشم، برندهٔ جایزه نوبل ادبیات سال ۱۹۶۲
جشن شب یلدا,جشن شب یلدا
ولادت  امام محمد باقر علیه السلام,ولادت  امام محمد باقر علیه السلام
روز میلاد خورشید؛ جشن خرم روز، نخستین جشن دیگان,روز میلاد خورشید؛ جشن خرم روز، نخستین جشن دیگان
شهادت امام علی النقی الهادی علیه السلام,شهادت امام علی النقی الهادی علیه السلام
درگذشت آنتونی فوکر بنیانگذار شرکت فوکر,درگذشت آنتونی فوکر بنیانگذار شرکت فوکر
زادروز احمد محمود نویسندهٔ معاصر ایرانی,زادروز احمد محمود نویسندهٔ معاصر ایرانی
درگذشت اکبر رادی نمایشنامه نویس ایرانی,درگذشت اکبر رادی نمایشنامه نویس ایرانی
جشن کریسمس,جشن کریسمس
زادروز اسحاق نیوتن فیزیکدان و ریاضیدان انگلیسی,زادروز اسحاق نیوتن فیزیکدان و ریاضیدان انگلیسی
درگذشت چارلی چاپلین بازیگر، کارگردان و آهنگساز، برندهٔ جایزه اسکار,درگذشت چارلی چاپلین بازیگر، کارگردان و آهنگساز، برندهٔ جایزه اسکار
سالروز زمین لرزه ی بم,زمین لرزه ی بم [1382 خورشیدی]
سالروز شهادت آشو زرتشت، اَبَراِنسان بزرگ تاریخ,سالروز شهادت آشو زرتشت، اَبَراِنسان بزرگ تاریخ
زادروز یوهانس کپلر دانشمند، ریاضیدان و ستاره‌شناس سرشناس آلمانی,زادروز یوهانس کپلر دانشمند، ریاضیدان و ستاره‌شناس سرشناس آلمانی
زادروز فروغ فرخزاد شاعر ایرانی,زادروز فروغ فرخزاد شاعر ایرانی
درگذشت سوزان سونتاگ نویسنده، نظریه‌پرداز ادبی و فعال سیاسی اهل آمریکا,درگذشت سوزان سونتاگ نویسنده، نظریه‌پرداز ادبی و فعال سیاسی اهل آمریکا
دی به آذر روز، دومین جشن دیگان,دی به آذر روز، دومین جشن دیگان
زادروز فروغ فرخزاد شاعر ایرانی,زادروز فروغ فرخزاد شاعر ایرانی
درگذشت کارل اشپیتلر شاعر سوئیسی، برنده جایزه نوبل ادبیات سال ۱۹۱۹,درگذشت کارل اشپیتلر شاعر سوئیسی، برنده جایزه نوبل ادبیات سال ۱۹۱۹
زادروز رونالد کوز، اقتصاددان و نویسندهٔ اهل بریتانیا، برندهٔ جایزه نوبل اقتصاد سال ۱۹۹۱,زادروز رونالد کوز، اقتصاددان و نویسندهٔ اهل بریتانیا، برندهٔ جایزه نوبل اقتصاد سال ۱۹۹۱
ولادت امام محمد تقی علیه السلام,ولادت امام محمد تقی علیه السلام
