event,event_key
جشن نوروز,جشن نوروز
شهادت حضرت علی علیه السلام,شهادت حضرت علی علیه السلام
روز جهانی شعر,روز جهانی شعر
عیدنوروز,عیدنوروز
شب قدر,شب قدر
روز جهانی آب,روز جهانی آب
عیدنوروز,عیدنوروز
درگذشت فریدریش آوگوست فون هایک  قتصاددان و فیلسوف سیاسی، برندهٔ جایزه نوبل اقتصاد سال ۱۹۷۴,درگذشت فریدریش آوگوست فون هایک  قتصاددان و فیلسوف سیاسی، برندهٔ جایزه نوبل اقتصاد سال ۱۹۷۴
عیدنوروز,عیدنوروز
درگذشت اسماعیل ادیب خوانساری موسیقیدان ایرانی,درگذشت اسماعیل ادیب خوانساری موسیقیدان ایرانی
زادروز پیتر دبای دانشمند هلندی، برندهٔ جایزه نوبل شیمی سال ۱۹۳۶ میلادی,زادروز پیتر دبای دانشمند هلندی، برندهٔ جایزه نوبل شیمی سال ۱۹۳۶ میلادی
روز امید، روز شادباش نویسی,روز امید، روز شادباش نویسی
زادروز آشو زرتشت، اَبَراِنسان بزرگ تاریخ,زادروز آشو زرتشت، اَبَراِنسان بزرگ تاریخ
زادروز لری پیج کارآفرین و مبتکر آمریکایی، بنیانگذار شرکت گوگل مدیر عامل اجرایی گوگل,زادروز لری پیج کارآفرین و مبتکر آمریکایی، بنیانگذار شرکت گوگل مدیر عامل اجرایی گوگل
درگذشت لودویگ فان بتهوون موسیقی‌دان برجستهٔ آلمانی,درگذشت لودویگ فان بتهوون موسیقی‌دان برجستهٔ آلمانی
روز جهانی تئاتر,روز جهانی تئاتر
درگذشت ویرجینیا وولف، رمان‌نویس، مقاله‌نویس، ناشر، منتقد و فمینیست انگلیسی,درگذشت ویرجینیا وولف، رمان‌نویس، مقاله‌نویس، ناشر، منتقد و فمینیست انگلیسی
جشن آبانگاه,جشن آبانگاه
عید سعید فطر,عید سعید فطر
درگذشت فریدریش برژیوس شیمیدان آلمانی، برندهٔ جایزه نوبل شیمی سال ۱۹۳۱,درگذشت فریدریش برژیوس شیمیدان آلمانی، برندهٔ جایزه نوبل شیمی سال ۱۹۳۱
تعطیل به مناسبت عید سعید فطر,تعطیل به مناسبت عید سعید فطر
برج ایفل در پاریس بطور رسمی گشایش یافت.,برج ایفل در پاریس بطور رسمی گشایش یافت.
روز جمهوری اسلامی,روز جمهوری اسلامی
جشن سیزده به در,جشن سیزده به در
درگذشت علی‌اکبر صنعتی نقاش و مجسمه‌ساز ایرانی,درگذشت علی‌اکبر صنعتی نقاش و مجسمه‌ساز ایرانی
روز جهانی کتاب کودک,روز جهانی کتاب کودک
روز جهانی اطلاع‌رسانی دربارهٔ بیماری اوتیسم,روز جهانی اطلاع‌رسانی دربارهٔ بیماری اوتیسم
زادروز ابوالحسن صبا موسیقیدان، آهنگساز و نوازندهٔ سرشناس ایرانی,زادروز ابوالحسن صبا موسیقیدان، آهنگساز و نوازندهٔ سرشناس ایرانی
درگذشت یوهانس برامس موسیقی‌دان بزرگ آلمانی,درگذشت یوهانس برامس موسیقی‌دان بزرگ آلمانی
درگذشت پروین اعتصامی,درگذشت پروین اعتصامی
گشایش رسمی مرکز تجارت جهانی,گشایش رسمی مرکز تجارت جهانی
درگذشت ویلهلم اوستوالد شیمیدان آلمانی، برنده جایزه نوبل شیمی سال ۱۹۰۹,درگذشت ویلهلم اوستوالد شیمیدان آلمانی، برنده جایزه نوبل شیمی سال ۱۹۰۹
سروش روز،جشن سروشگان,سروش روز،جشن سروشگان
درگذشت توماسو آلبینونی آهنگساز ایتالیایی,درگذشت توماسو آلبینونی آهنگساز ایتالیایی
زاد روز هورست لودویگ اشتورمر فیزیکدان آلمانی، برندهٔ جایزه نوبل فیزیک سال ۱۹۹۸,زاد روز هورست لودویگ اشتورمر فیزیکدان آلمانی، برندهٔ جایزه نوبل فیزیک سال ۱۹۹۸
زاد روز جیمز واتسون ،زیست‌فیزیکدان و متخصّص علم ژنتیک آمریکایی، برندهٔ جایزه نوبل فیزیولوژی و پزشکی سال ۱۹۶۲,زاد روز جیمز واتسون ،زیست‌فیزیکدان و متخصّص علم ژنتیک آمریکایی، برندهٔ جایزه نوبل فیزیولوژی و پزشکی سال ۱۹۶۲
روز جهانی بهداشت,روز جهانی بهداشت
فروردین روز،جشن فروردینگان,فروردین روز،جشن فروردینگان
درگذشت پابلو پیکاسو  نقاش، شاعر، طراح صحنه، پیکرتراش، گراورساز و سرامیک‌کار اسپانیایی، از بنیانگذاران سبک کوبیسم,درگذشت پابلو پیکاسو  نقاش، شاعر، طراح صحنه، پیکرتراش، گراورساز و سرامیک‌کار اسپانیایی، از بنیانگذاران سبک کوبیسم
درگذشت اریک آکسل کارلفلدت شاعر نمادگرای سوئدی، برندهٔ جایزه نوبل ادبیات سال ۱۹۳۱,درگذشت اریک آکسل کارلفلدت شاعر نمادگرای سوئدی، برندهٔ جایزه نوبل ادبیات سال ۱۹۳۱
درگذشت فرانسوا رابله ادیب، پزشک و نویسنده بزرگ رنسانس فرانسه,درگذشت فرانسوا رابله ادیب، پزشک و نویسنده بزرگ رنسانس فرانسه
درگذشت جبران خلیل جبران نویسنده سرشناس لبنان و آمریکا، خالق اثر مشهور پیامبر,درگذشت جبران خلیل جبران نویسنده سرشناس لبنان و آمریکا، خالق اثر مشهور پیامبر
زادروز جوزف پولیتزر روزنامه‌نگار معروف آمریکایی و بنیانگذار جایزه ادبی پولیتزر,زادروز جوزف پولیتزر روزنامه‌نگار معروف آمریکایی و بنیانگذار جایزه ادبی پولیتزر
زادروز آدلاید لابلی گویارد نقاش فرانسوی,زادروز آدلاید لابلی گویارد نقاش فرانسوی
روز دندانپزشک,روز دندانپزشک
زادروز یان تینبرگن اقتصاددان، برنده جایزه نوبل اقتصاد سال ۱۹۶۹,زادروز یان تینبرگن اقتصاددان، برنده جایزه نوبل اقتصاد سال ۱۹۶۹
درگذشت ایگور یوگنیویچ تام فیزیکدان و ریاضی‌دان روسی، برنده جایزه نوبل فیزیک سال ۱۹۵۸,درگذشت ایگور یوگنیویچ تام فیزیکدان و ریاضی‌دان روسی، برنده جایزه نوبل فیزیک سال ۱۹۵۸
درگذشت جان ویلر فیزیکدان آمریکایی، از پیشگامان فیزیک هسته‌ای,درگذشت جان ویلر فیزیکدان آمریکایی، از پیشگامان فیزیک هسته‌ای
روز بزرگداشت عطار نیشابوری,روز بزرگداشت عطار نیشابوری
کشتی مسافربر تایتانیک با ۲۲۰۰ مسافر و خدمه در حوالی کانادا غرق شد.,کشتی مسافربر تایتانیک با ۲۲۰۰ مسافر و خدمه در حوالی کانادا غرق شد.
درگذشت جرج فردریک هندل آهنگساز آلمانی,درگذشت جرج فردریک هندل آهنگساز آلمانی
زاد روز لئوناردو داوینچی دانشمند، نقاش، مجسمه‌ساز و معمار نامدار ایتالیایی,زاد روز لئوناردو داوینچی دانشمند، نقاش، مجسمه‌ساز و معمار نامدار ایتالیایی
درگذشت میخاییل لومونسف نویسنده و دانشمند روسی,درگذشت میخاییل لومونسف نویسنده و دانشمند روسی
زادروز چارلی چاپلین کمدین مشهور، کارگردان و آهنگساز برجستهٔ هالیوود، برندهٔ جایزه اسکار,زادروز چارلی چاپلین کمدین مشهور، کارگردان و آهنگساز برجستهٔ هالیوود، برندهٔ جایزه اسکار
درگذشت یاسوناری کاواباتا نویسنده ژاپنی، برندهٔ جایزه ادبیات نوبل,درگذشت یاسوناری کاواباتا نویسنده ژاپنی، برندهٔ جایزه ادبیات نوبل
درگذشت بنجامین فرانکلین ، دانشمند، نویسنده، ناشر، روزنامه‌نگار، سیاستمدار و دیپلمات دوران انقلاب استقلال آمریکا,درگذشت بنجامین فرانکلین ، دانشمند، نویسنده، ناشر، روزنامه‌نگار، سیاستمدار و دیپلمات دوران انقلاب استقلال آمریکا
درگذشت هنریک کارل پیتر دام زیست‌شناس و شیمیدان برندهٔ جایزه نوبل پزشکی ۱۹۴۳ از دانمارک,درگذشت هنریک کارل پیتر دام زیست‌شناس و شیمیدان برندهٔ جایزه نوبل پزشکی ۱۹۴۳ از دانمارک
روز ارتش جمهوری اسلامی ایران,روز ارتش جمهوری اسلامی ایران
روز جهانی میراث فرهنگی,روز جهانی میراث فرهنگی
روز علوم آزمایشگاهی، زاد روز حکیم سید اسماعیل جرجانی,روز علوم آزمایشگاهی، زاد روز حکیم سید اسماعیل جرجانی
درگذشت پی‌یر کوری فیزیکدان فرانسوی، برندهٔ جایزه نوبل فیزیک سال۱۹۰۳ به همراه ماری کوری,درگذشت پی‌یر کوری فیزیکدان فرانسوی، برندهٔ جایزه نوبل فیزیک سال۱۹۰۳ به همراه ماری کوری
زادروز گلن سیبورگ دانشمند آمریکایی، برندهٔ جایزه نوبل شیمی سال ۱۹۵۱,زادروز گلن سیبورگ دانشمند آمریکایی، برندهٔ جایزه نوبل شیمی سال ۱۹۵۱
روز بزرگداشت سعدی,روز بزرگداشت سعدی
درگذشت سهراب سپهری شاعر و نقاش ایرانی,درگذشت سهراب سپهری شاعر و نقاش ایرانی
جشن گیاه آوری؛ روز زمین,جشن گیاه آوری؛ روز زمین
زادروز قیصر امین‌پور نویسنده، مدرس دانشگاه و شاعر معاصرایرانی,زادروز قیصر امین‌پور نویسنده، مدرس دانشگاه و شاعر معاصرایرانی
زادروز یاور همدانی، شاعر و نویسنده و پژوهشگر ایرانی,زادروز یاور همدانی، شاعر و نویسنده و پژوهشگر ایرانی
روزبزرگداشت شیخ بهایی؛ روزملی کارآفرینی,روزبزرگداشت شیخ بهایی؛ روزملی کارآفرینی
شهادت امام جعفر صادق علیه السلام,شهادت امام جعفر صادق علیه السلام
روز جهانی کتاب و حق نشر,روز جهانی کتاب و حق نشر
آغاز به کار نخستین فرستنده عمومی رادیویی در ایران به نام «رادیو تهران»,آغاز به کار نخستین فرستنده عمومی رادیویی در ایران به نام «رادیو تهران»
زادروز کارل اشپیتلر شاعر سوئیسی آلمانی، برندهٔ جایزه نوبل ادبیات سال ۱۹۱۹,زادروز کارل اشپیتلر شاعر سوئیسی آلمانی، برندهٔ جایزه نوبل ادبیات سال ۱۹۱۹
درگذشت ماکس فون لائو فیزیک‌دان آلمانی، برندهٔ جایزه نوبل فیزیک سال ۱۹۱۴,درگذشت ماکس فون لائو فیزیک‌دان آلمانی، برندهٔ جایزه نوبل فیزیک سال ۱۹۱۴
زادروز گولیلمو مارکونی مهندس برق ایتالیایی، برندهٔ جایزه نوبل فیزیک,زادروز گولیلمو مارکونی مهندس برق ایتالیایی، برندهٔ جایزه نوبل فیزیک
زادروز جلیل ضیاءپور، پدر نقاشی مدرن ایران,زادروز جلیل ضیاءپور، پدر نقاشی مدرن ایران
درگذشت بیورنستیرن بیورنسون نویسندهٔ نروژی، برندهٔ جایزه نوبل ادبیات سال ۱۹۰۳,درگذشت بیورنستیرن بیورنسون نویسندهٔ نروژی، برندهٔ جایزه نوبل ادبیات سال ۱۹۰۳
درگذشت کارل بوش شیمی‌دان و مهندس آلمانی، برندهٔ جایزه نوبل شیمی۱۹۳۱,درگذشت کارل بوش شیمی‌دان و مهندس آلمانی، برندهٔ جایزه نوبل شیمی۱۹۳۱
درگذشت رالف والدو امرسون فیلسوف و نویسندهٔ آمریکایی,درگذشت رالف والدو امرسون فیلسوف و نویسندهٔ آمریکایی
زادروز سیمین دانشور نویسنده و مترجم ایرانی,زادروز سیمین دانشور نویسنده و مترجم ایرانی
روزشوراها,روزشوراها
ولادت حضرت معصومه سلام الله علیها و روز دختران,ولادت حضرت معصومه سلام الله علیها و روز دختران
روز جهانی روانشناس و مشاور,روز جهانی روانشناس و مشاور
درگذشت ذبیح‌الله صفا، پژوهشگر، مترجم و استاد ممتاز دانشگاه تهران,درگذشت ذبیح‌الله صفا، پژوهشگر، مترجم و استاد ممتاز دانشگاه تهران
جشن چهلم نوروز؛ روز ملی خلیج فارس,جشن چهلم نوروز؛ روز ملی خلیج فارس
زادروز کارل فریدریش گاوس ریاضیدان مشهور آلمانی,زادروز کارل فریدریش گاوس ریاضیدان مشهور آلمانی
روزجهانی  کارگر,روزجهانی  کارگر
انتشار نخستین روزنامه در ایران به نام «کاغذ اخبار» توسط «میرزا صالح شیرازی»,انتشار نخستین روزنامه در ایران به نام «کاغذ اخبار» توسط «میرزا صالح شیرازی»
شهادت استاد مرتضی مطهری، روزمعلم,شهادت استاد مرتضی مطهری، روزمعلم
درگذشت محمدرضا لطفی، نوازندهٔ برجسته و سرشناس تار، سه‌تار و ردیف‌دان، موسیقی‌دان و آهنگساز,درگذشت محمدرضا لطفی، نوازندهٔ برجسته و سرشناس تار، سه‌تار و ردیف‌دان، موسیقی‌دان و آهنگساز
درگذشت لئوناردو داوینچی، دانشمند و هنرمند ایتالیایی دورهٔ رنسانس,درگذشت لئوناردو داوینچی، دانشمند و هنرمند ایتالیایی دورهٔ رنسانس
زادروز جرج پاجت تامسون فیزیک‌دان انگلیسی، برندهٔ جایزه نوبل سال ۱۹۳۷,زادروز جرج پاجت تامسون فیزیک‌دان انگلیسی، برندهٔ جایزه نوبل سال ۱۹۳۷
زادروز آلفرد کاستلر فیزیکدان فرانسوی، برندهٔ جایزه نوبل فیزیک سال ۱۹۶۶,زادروز آلفرد کاستلر فیزیکدان فرانسوی، برندهٔ جایزه نوبل فیزیک سال ۱۹۶۶
زادروزخواجه عبدالله انصاری، ادیب، عارف و اندیشمند ایرانی,زادروزخواجه عبدالله انصاری، ادیب، عارف و اندیشمند ایرانی
جشن میانه بهار,جشن میانه بهار
روز جهانی ماما,روز جهانی ماما
زادروز غلامحسین بنان، خوانندهٔ ایرانی,زادروز غلامحسین بنان، خوانندهٔ ایرانی
درگذشت حسین منزوی شاعر نامدار ایرانی,درگذشت حسین منزوی شاعر نامدار ایرانی
روز اسناد ملی و میراث مکتوب,روز اسناد ملی و میراث مکتوب
رابیندرانات تاگور شاعر، نویسنده، نقاش و آهنگساز بنگالی، برندهٔ جایزه نوبل ادبیات سال ۱۹۱۳,رابیندرانات تاگور شاعر، نویسنده، نقاش و آهنگساز بنگالی، برندهٔ جایزه نوبل ادبیات سال ۱۹۱۳
درگذشت ویلارد بویل فیزیکدان کانادایی، برندهٔ جایزه نوبل فیزیک سال ۲۰۰۹,درگذشت ویلارد بویل فیزیکدان کانادایی، برندهٔ جایزه نوبل فیزیک سال ۲۰۰۹
روز جهانی صلیب سرخ و هلال احمر,روز جهانی صلیب سرخ و هلال احمر
ولادت امام  رضا علیه السلام,ولادت امام  رضا علیه السلام
درگذشت آلبرت آبراهام مایکلسون فیزیک‌دان آمریکایی، برندهٔ جایزه فیزیک نوبل سال ۱۹۰۷,درگذشت آلبرت آبراهام مایکلسون فیزیک‌دان آمریکایی، برندهٔ جایزه فیزیک نوبل سال ۱۹۰۷
درگذشت توماس یانگ فیزیک‌دان برجستهٔ انگلیسی,درگذشت توماس یانگ فیزیک‌دان برجستهٔ انگلیسی
نلسون ماندلا، پس از پیروزی در انتخابات، نخستین رئیس‌جمهور سیاه‌پوست آفریقای جنوبی شد.,نلسون ماندلا، پس از پیروزی در انتخابات، نخستین رئیس‌جمهور سیاه‌پوست آفریقای جنوبی شد.
زادروز فرنگیس یگانگی بنیان‌گذار و نخستین مدیرعامل سازمان صنایع دستی ایران,زادروز فرنگیس یگانگی بنیان‌گذار و نخستین مدیرعامل سازمان صنایع دستی ایران
زادروز مریم میرزاخانی ریاضیدان ایرانی، اولین زن برندهٔ جایزه فیلدز,زادروز مریم میرزاخانی ریاضیدان ایرانی، اولین زن برندهٔ جایزه فیلدز
روز جهانی زن در ریاضیات (به افتخار روز تولد مریم میرزاخانی),روز جهانی زن در ریاضیات (به افتخار روز تولد مریم میرزاخانی)
درگذشت ژوزف هانری دانشمند و فیزیکدان سرشناس آمریکایی,درگذشت ژوزف هانری دانشمند و فیزیکدان سرشناس آمریکایی
زادروز پرویز مشکاتیان آهنگساز، موسیقی‌دان و نوازندهٔ سنتور,زادروز پرویز مشکاتیان آهنگساز، موسیقی‌دان و نوازندهٔ سنتور
روز بزرگداشت فردوسی,روز بزرگداشت فردوسی
روز ارتباطات و روابط عمومی,روز ارتباطات و روابط عمومی
زادروز ادوارد جنر، پزشک انگلیسی، کاشف واکسن بیماری آبله,زادروز ادوارد جنر، پزشک انگلیسی، کاشف واکسن بیماری آبله
روز بزرگداشت حکیم عمر خیام,روز بزرگداشت حکیم عمر خیام
روز جهانی موزه و میراث فرهنگی,روز جهانی موزه و میراث فرهنگی
زادروز برتراند راسل ریاضی‌دان، فیلسوف و نویسندهٔ انگلیسی,زادروز برتراند راسل ریاضی‌دان، فیلسوف و نویسندهٔ انگلیسی
زادروز ناتانیل هاثورن نویسنده آمریکایی,زادروز ناتانیل هاثورن نویسنده آمریکایی
زادروز یوهان گوتلیب فیشته فیلسوف ایدئالیست آلمانی,زادروز یوهان گوتلیب فیشته فیلسوف ایدئالیست آلمانی
زادروز جان استوارت‌میل، فیلسوف و اقتصاددان انگلیسی,زادروز جان استوارت‌میل، فیلسوف و اقتصاددان انگلیسی
درگذشت کریستف کلمب، دریانورد و کاشف ایتالیایی,درگذشت کریستف کلمب، دریانورد و کاشف ایتالیایی
روز بهره وری و بهینه سازی مصرف,روز بهره وری و بهینه سازی مصرف
روز بزرگداشت ملاصدرا,روز بزرگداشت ملاصدرا
زادروز جلیل شهناز، از سرشناس‌ترین نوازندگان تار و سه تار سدهٔ اخیر در ایران,زادروز جلیل شهناز، از سرشناس‌ترین نوازندگان تار و سه تار سدهٔ اخیر در ایران
درگذشت ویکتور هوگو شاعر و رمان‌نویس فرانسوی، خالق بینوایان,درگذشت ویکتور هوگو شاعر و رمان‌نویس فرانسوی، خالق بینوایان
درگذشت هنریک ایبسن شاعر، نمایش‌نامه‌نویس و درام‌نویس نروژی,درگذشت هنریک ایبسن شاعر، نمایش‌نامه‌نویس و درام‌نویس نروژی
فتح خرمشهر در عملیات بیت المقدس و روز مقاومت، ایثار و پیروزی,فتح خرمشهر در عملیات بیت المقدس و روز مقاومت، ایثار و پیروزی
روز دزفول، روز مقاومت و پایداری,روز دزفول، روز مقاومت و پایداری
زادروز ریموند کارور، نویسندهٔ داستان‌های کوتاه و شاعر آمریکایی,زادروز ریموند کارور، نویسندهٔ داستان‌های کوتاه و شاعر آمریکایی
درگذشت هوشنگ سیحون معمار، طراح، نقاش و مجسمه‌ساز ایرانی,درگذشت هوشنگ سیحون معمار، طراح، نقاش و مجسمه‌ساز ایرانی
خرداد روز،جشن خردادگان,خرداد روز،جشن خردادگان
پل گلدن گیت، که در زمان تکمیل، طولانی‌ترین پل معلق دنیا محسوب می‌شد، گشایش یافت.,پل گلدن گیت، که در زمان تکمیل، طولانی‌ترین پل معلق دنیا محسوب می‌شد، گشایش یافت.
درگذشت ارنست روسکا فیزیکدان آلمانی، مخترع میکروسکوپ الکترونی، برندهٔ جایزه نوبل فیزیک سال ۱۹۸۶,درگذشت ارنست روسکا فیزیکدان آلمانی، مخترع میکروسکوپ الکترونی، برندهٔ جایزه نوبل فیزیک سال ۱۹۸۶
زادروز پاتریک وایت نویسنده اهل کشور استرالیا، برندهٔ جایزه نوبل ادبیات سال ۱۹۷۳,زادروز پاتریک وایت نویسنده اهل کشور استرالیا، برندهٔ جایزه نوبل ادبیات سال ۱۹۷۳
درگذشت ایلیا پریگوژین شیمی فیزیکدان روسی، برندهٔ جایزه نوبل شیمی سال ۱۹۷۷,درگذشت ایلیا پریگوژین شیمی فیزیکدان روسی، برندهٔ جایزه نوبل شیمی سال ۱۹۷۷
زادروز پیتر هیگز فیزیک‌دان انگلیسی، برندهٔ جایزه نوبل فیزیک سال ۲۰۱۳,زادروز پیتر هیگز فیزیک‌دان انگلیسی، برندهٔ جایزه نوبل فیزیک سال ۲۰۱۳
درگذشت خوآن رامون خیمنس شاعر اسپانیایی، برندهٔ جایزه نوبل ادبیات سال ۱۹۵۶,درگذشت خوآن رامون خیمنس شاعر اسپانیایی، برندهٔ جایزه نوبل ادبیات سال ۱۹۵۶
درگذشت فرانسوا-ماری آروئه با نام مستعار وُلتر، فیلسوف و نویسنده فرانسوی,درگذشت فرانسوا-ماری آروئه با نام مستعار وُلتر، فیلسوف و نویسنده فرانسوی
زادروز برایان کبیلکا شیمیدان آمریکایی، برنده جایزه نوبل شیمی سال ۲۰۱۲,زادروز برایان کبیلکا شیمیدان آمریکایی، برنده جایزه نوبل شیمی سال ۲۰۱۲
درگذشت یوزف هایدن، موسیقی‌دان و آهنگ‌ساز اتریشی,درگذشت یوزف هایدن، موسیقی‌دان و آهنگ‌ساز اتریشی
درگذشت اواریست گالوا ریاضی‌دان فرانسوی، واضع نظریهٔ گروه در علم جبر,درگذشت اواریست گالوا ریاضی‌دان فرانسوی، واضع نظریهٔ گروه در علم جبر
